{
  "$schema": "https://json-schema.org/draft/2020-12/schema",
  "type": "object",
  "properties": {
    "schema": {
      "type": "string",
      "const": "usl-portable-transfer-envelope/v1"
    },
    "bodyDigestAlgorithm": {
      "type": "string",
      "const": "USL_CONTRACT_SHA256_V1"
    },
    "manifestDigest": {
      "type": "string",
      "pattern": "^sha256:[a-f0-9]{64}$"
    },
    "manifest": {
      "type": "object",
      "properties": {
        "schema": {
          "type": "string",
          "const": "usl-portable-transfer/v1"
        },
        "ownerNamespace": {
          "type": "string",
          "minLength": 1,
          "maxLength": 4096,
          "allOf": [
            {
              "pattern": "\\S"
            },
            {
              "pattern": "^[A-Za-z][A-Za-z0-9+.-]*:[^\\s<>\"{}|^`\\\\\\u0000-\\u001f\\u007f]+$"
            },
            {
              "pattern": "^(?:[^%]|%[A-Fa-f0-9]{2})+$"
            }
          ]
        },
        "issuer": {
          "type": "string",
          "minLength": 1,
          "maxLength": 512,
          "allOf": [
            {
              "pattern": "\\S"
            },
            {
              "pattern": "^[A-Za-z][A-Za-z0-9+.-]*:[^\\s<>\"{}|^`\\\\\\u0000-\\u001f\\u007f]+$"
            },
            {
              "pattern": "^(?:[^%]|%[A-Fa-f0-9]{2})+$"
            }
          ]
        },
        "observedAt": {
          "type": "string",
          "format": "date-time",
          "pattern": "^(?:(?:\\d\\d[2468][048]|\\d\\d[13579][26]|\\d\\d0[48]|[02468][048]00|[13579][26]00)-02-29|\\d{4}-(?:(?:0[13578]|1[02])-(?:0[1-9]|[12]\\d|3[01])|(?:0[469]|11)-(?:0[1-9]|[12]\\d|30)|(?:02)-(?:0[1-9]|1\\d|2[0-8])))T(?:(?:[01]\\d|2[0-3]):[0-5]\\d:[0-5]\\d(?:\\.\\d+)?(?:Z))$"
        },
        "resources": {
          "minItems": 1,
          "maxItems": 1024,
          "type": "array",
          "items": {
            "type": "object",
            "properties": {
              "ownerNamespace": {
                "type": "string",
                "minLength": 1,
                "maxLength": 4096,
                "allOf": [
                  {
                    "pattern": "\\S"
                  },
                  {
                    "pattern": "^[A-Za-z][A-Za-z0-9+.-]*:[^\\s<>\"{}|^`\\\\\\u0000-\\u001f\\u007f]+$"
                  },
                  {
                    "pattern": "^(?:[^%]|%[A-Fa-f0-9]{2})+$"
                  }
                ]
              },
              "nativeId": {
                "type": "string",
                "minLength": 1,
                "maxLength": 256,
                "allOf": [
                  {
                    "pattern": "\\S"
                  },
                  {
                    "pattern": "^[^\\u0000-\\u001f\\u007f-\\u009f]+$"
                  }
                ]
              },
              "derivedFrom": {
                "type": "object",
                "properties": {
                  "ownerNamespace": {
                    "type": "string",
                    "minLength": 1,
                    "maxLength": 4096,
                    "allOf": [
                      {
                        "pattern": "\\S"
                      },
                      {
                        "pattern": "^[A-Za-z][A-Za-z0-9+.-]*:[^\\s<>\"{}|^`\\\\\\u0000-\\u001f\\u007f]+$"
                      },
                      {
                        "pattern": "^(?:[^%]|%[A-Fa-f0-9]{2})+$"
                      }
                    ]
                  },
                  "nativeId": {
                    "type": "string",
                    "minLength": 1,
                    "maxLength": 256,
                    "allOf": [
                      {
                        "pattern": "\\S"
                      },
                      {
                        "pattern": "^[^\\u0000-\\u001f\\u007f-\\u009f]+$"
                      }
                    ]
                  }
                },
                "required": [
                  "ownerNamespace",
                  "nativeId"
                ],
                "additionalProperties": false
              }
            },
            "required": [
              "ownerNamespace",
              "nativeId"
            ],
            "additionalProperties": false
          }
        },
        "revisions": {
          "minItems": 1,
          "maxItems": 4096,
          "type": "array",
          "items": {
            "type": "object",
            "properties": {
              "id": {
                "type": "string",
                "minLength": 1,
                "maxLength": 512,
                "allOf": [
                  {
                    "pattern": "\\S"
                  },
                  {
                    "pattern": "^[A-Za-z][A-Za-z0-9+.-]*:[^\\s<>\"{}|^`\\\\\\u0000-\\u001f\\u007f]+$"
                  },
                  {
                    "pattern": "^(?:[^%]|%[A-Fa-f0-9]{2})+$"
                  }
                ]
              },
              "resource": {
                "type": "object",
                "properties": {
                  "ownerNamespace": {
                    "type": "string",
                    "minLength": 1,
                    "maxLength": 4096,
                    "allOf": [
                      {
                        "pattern": "\\S"
                      },
                      {
                        "pattern": "^[A-Za-z][A-Za-z0-9+.-]*:[^\\s<>\"{}|^`\\\\\\u0000-\\u001f\\u007f]+$"
                      },
                      {
                        "pattern": "^(?:[^%]|%[A-Fa-f0-9]{2})+$"
                      }
                    ]
                  },
                  "nativeId": {
                    "type": "string",
                    "minLength": 1,
                    "maxLength": 256,
                    "allOf": [
                      {
                        "pattern": "\\S"
                      },
                      {
                        "pattern": "^[^\\u0000-\\u001f\\u007f-\\u009f]+$"
                      }
                    ]
                  }
                },
                "required": [
                  "ownerNamespace",
                  "nativeId"
                ],
                "additionalProperties": false
              },
              "kind": {
                "type": "string",
                "enum": [
                  "CONTENT",
                  "TOMBSTONE"
                ]
              },
              "parents": {
                "maxItems": 64,
                "type": "array",
                "items": {
                  "type": "string",
                  "minLength": 1,
                  "maxLength": 512,
                  "allOf": [
                    {
                      "pattern": "\\S"
                    },
                    {
                      "pattern": "^[A-Za-z][A-Za-z0-9+.-]*:[^\\s<>\"{}|^`\\\\\\u0000-\\u001f\\u007f]+$"
                    },
                    {
                      "pattern": "^(?:[^%]|%[A-Fa-f0-9]{2})+$"
                    }
                  ]
                }
              },
              "issuer": {
                "type": "string",
                "minLength": 1,
                "maxLength": 512,
                "allOf": [
                  {
                    "pattern": "\\S"
                  },
                  {
                    "pattern": "^[A-Za-z][A-Za-z0-9+.-]*:[^\\s<>\"{}|^`\\\\\\u0000-\\u001f\\u007f]+$"
                  },
                  {
                    "pattern": "^(?:[^%]|%[A-Fa-f0-9]{2})+$"
                  }
                ]
              }
            },
            "required": [
              "id",
              "resource",
              "kind",
              "parents",
              "issuer"
            ],
            "additionalProperties": false
          }
        },
        "representations": {
          "maxItems": 4096,
          "type": "array",
          "items": {
            "type": "object",
            "properties": {
              "id": {
                "type": "string",
                "minLength": 1,
                "maxLength": 512,
                "allOf": [
                  {
                    "pattern": "\\S"
                  },
                  {
                    "pattern": "^[A-Za-z][A-Za-z0-9+.-]*:[^\\s<>\"{}|^`\\\\\\u0000-\\u001f\\u007f]+$"
                  },
                  {
                    "pattern": "^(?:[^%]|%[A-Fa-f0-9]{2})+$"
                  }
                ]
              },
              "revision": {
                "type": "string",
                "minLength": 1,
                "maxLength": 512,
                "allOf": [
                  {
                    "pattern": "\\S"
                  },
                  {
                    "pattern": "^[A-Za-z][A-Za-z0-9+.-]*:[^\\s<>\"{}|^`\\\\\\u0000-\\u001f\\u007f]+$"
                  },
                  {
                    "pattern": "^(?:[^%]|%[A-Fa-f0-9]{2})+$"
                  }
                ]
              },
              "payloadPath": {
                "type": "string",
                "minLength": 1,
                "maxLength": 1024
              },
              "byteDigestAlgorithm": {
                "type": "string",
                "const": "SHA256_RAW_BYTES_V1"
              },
              "byteDigest": {
                "type": "string",
                "pattern": "^sha256:[a-f0-9]{64}$"
              },
              "byteLength": {
                "type": "integer",
                "minimum": 0,
                "maximum": 9007199254740991
              }
            },
            "required": [
              "id",
              "revision",
              "payloadPath",
              "byteDigestAlgorithm",
              "byteDigest",
              "byteLength"
            ],
            "additionalProperties": false
          }
        },
        "historyBoundary": {
          "type": "object",
          "properties": {
            "mode": {
              "type": "string",
              "const": "CLOSED_V1"
            },
            "externalParents": {
              "maxItems": 1024,
              "type": "array",
              "items": {
                "type": "object",
                "properties": {
                  "revision": {
                    "type": "string",
                    "minLength": 1,
                    "maxLength": 512,
                    "allOf": [
                      {
                        "pattern": "\\S"
                      },
                      {
                        "pattern": "^[A-Za-z][A-Za-z0-9+.-]*:[^\\s<>\"{}|^`\\\\\\u0000-\\u001f\\u007f]+$"
                      },
                      {
                        "pattern": "^(?:[^%]|%[A-Fa-f0-9]{2})+$"
                      }
                    ]
                  },
                  "resource": {
                    "type": "object",
                    "properties": {
                      "ownerNamespace": {
                        "type": "string",
                        "minLength": 1,
                        "maxLength": 4096,
                        "allOf": [
                          {
                            "pattern": "\\S"
                          },
                          {
                            "pattern": "^[A-Za-z][A-Za-z0-9+.-]*:[^\\s<>\"{}|^`\\\\\\u0000-\\u001f\\u007f]+$"
                          },
                          {
                            "pattern": "^(?:[^%]|%[A-Fa-f0-9]{2})+$"
                          }
                        ]
                      },
                      "nativeId": {
                        "type": "string",
                        "minLength": 1,
                        "maxLength": 256,
                        "allOf": [
                          {
                            "pattern": "\\S"
                          },
                          {
                            "pattern": "^[^\\u0000-\\u001f\\u007f-\\u009f]+$"
                          }
                        ]
                      }
                    },
                    "required": [
                      "ownerNamespace",
                      "nativeId"
                    ],
                    "additionalProperties": false
                  },
                  "digestAlgorithm": {
                    "type": "string",
                    "const": "USL_CONTRACT_SHA256_V1"
                  },
                  "digest": {
                    "type": "string",
                    "pattern": "^sha256:[a-f0-9]{64}$"
                  }
                },
                "required": [
                  "revision",
                  "resource",
                  "digestAlgorithm",
                  "digest"
                ],
                "additionalProperties": false
              }
            }
          },
          "required": [
            "mode",
            "externalParents"
          ],
          "additionalProperties": false
        }
      },
      "required": [
        "schema",
        "ownerNamespace",
        "issuer",
        "observedAt",
        "resources",
        "revisions",
        "representations",
        "historyBoundary"
      ],
      "additionalProperties": false
    }
  },
  "required": [
    "schema",
    "bodyDigestAlgorithm",
    "manifestDigest",
    "manifest"
  ],
  "additionalProperties": false
}
